{
  "nodes": [
    {
      "id": 101,
      "userId": "u_1234567890",
      "origId": "c_abcdef123456",
      "clusterId": "cl_9876543210",
      "clusterName": "Project Alpha",
      "timestamp": "2025-01-01T12:00:00Z",
      "numMessages": 5,
      "sourceType": "chat",
      "createdAt": "2025-01-01T12:00:00Z",
      "updatedAt": "2025-01-01T12:00:00Z"
    }
  ],
  "edges": [
    {
      "id": "e_1234567890",
      "userId": "u_1234567890",
      "source": 101,
      "target": 102,
      "weight": 0.85,
      "type": "insight",
      "intraCluster": true,
      "createdAt": "2025-01-02T15:00:00Z",
      "updatedAt": "2025-01-02T15:00:00Z"
    }
  ],
  "clusters": [
    {
      "id": "cl_9876543210",
      "userId": "u_1234567890",
      "name": "Project Alpha",
      "description": "Discussions related to Project Alpha development.",
      "size": 15,
      "themes": ["development", "planning", "architecture"],
      "createdAt": "2025-01-01T10:00:00Z",
      "updatedAt": "2025-01-01T10:00:00Z"
    }
  ],
  "stats": {
    "nodes": 1,
    "edges": 1,
    "clusters": 1,
    "status": "CREATED",
    "generatedAt": "2025-01-03T09:00:00Z",
    "metadata": {
      "version": "1.0"
    }
  }
}
